{
  "$schema": "https://json-schema.org/draft/2020-12/schema",
  "$id": "https://github.com/jsnov/ai-triad-research/taxonomy/schemas/cross-cutting-taxonomy.schema.json",
  "title": "Cross-Cutting Taxonomy File",
  "description": "Schema for the cross-cutting taxonomy file in the AI Triad Research project. Cross-cutting nodes represent DOLCE D&S Situations — contested concepts where all three POV Descriptions classify the same phenomenon differently.",
  "type": "object",
  "required": [
    "_schema_version",
    "_doc",
    "last_modified",
    "nodes"
  ],
  "additionalProperties": false,
  "properties": {
    "_schema_version": {
      "type": "string",
      "description": "Semantic version of the schema this file conforms to.",
      "examples": ["1.0.0"]
    },
    "_doc": {
      "type": "string",
      "description": "Human-readable documentation string describing this file's purpose and editing conventions."
    },
    "last_modified": {
      "type": "string",
      "format": "date",
      "pattern": "^\\d{4}-\\d{2}-\\d{2}$",
      "description": "ISO 8601 date (YYYY-MM-DD) of the last modification to this file.",
      "examples": ["2026-02-22"]
    },
    "nodes": {
      "type": "array",
      "description": "Ordered list of cross-cutting taxonomy nodes.",
      "items": {
        "$ref": "#/$defs/CrossCuttingNode"
      }
    }
  },
  "$defs": {
    "CrossCuttingNode": {
      "type": "object",
      "description": "A cross-cutting node representing a DOLCE Situation — a contested concept that all three POV Descriptions classify differently. The interpretations field implements the D&S mechanism: three Descriptions of one Situation.",
      "required": [
        "id",
        "label",
        "description",
        "interpretations",
        "linked_nodes",
        "conflict_ids"
      ],
      "additionalProperties": false,
      "properties": {
        "id": {
          "type": "string",
          "minLength": 1,
          "pattern": "^cc-\\d{3}$",
          "description": "Unique identifier for this cross-cutting node. Format: cc-{sequence}.",
          "examples": ["cc-001", "cc-012"]
        },
        "label": {
          "type": "string",
          "minLength": 1,
          "description": "Short human-readable title for this cross-cutting concept.",
          "examples": ["AI Existential Risk", "Regulatory Capture"]
        },
        "description": {
          "type": "string",
          "minLength": 1,
          "description": "Genus-differentia description: 'A cross-cutting concept that [differentia]. Encompasses: ... Excludes: ...'"
        },
        "interpretations": {
          "type": "object",
          "description": "Per-POV interpretations — the DOLCE D&S mechanism. Three Descriptions of one Situation. Each POV explains how it understands this concept.",
          "required": ["accelerationist", "safetyist", "skeptic"],
          "additionalProperties": false,
          "properties": {
            "accelerationist": {
              "type": "string",
              "minLength": 1,
              "description": "How the accelerationist POV interprets this cross-cutting concept."
            },
            "safetyist": {
              "type": "string",
              "minLength": 1,
              "description": "How the safetyist POV interprets this cross-cutting concept."
            },
            "skeptic": {
              "type": "string",
              "minLength": 1,
              "description": "How the skeptic POV interprets this cross-cutting concept."
            }
          }
        },
        "linked_nodes": {
          "type": "array",
          "description": "List of POV node IDs that relate to this cross-cutting concept.",
          "items": {
            "type": "string"
          }
        },
        "conflict_ids": {
          "type": "array",
          "description": "List of conflict claim IDs associated with this cross-cutting concept.",
          "items": {
            "type": "string",
            "pattern": "^conflict-[a-z0-9-]+$"
          }
        },
        "disagreement_type": {
          "type": "string",
          "enum": ["definitional", "interpretive", "structural"],
          "description": "Classification of the cross-POV disagreement. definitional: POVs define the concept differently. interpretive: POVs agree on definition but disagree on implications. structural: POVs frame the issue differently at a foundational level."
        },
        "debate_refs": {
          "type": "array",
          "description": "Debate session IDs that referenced this node. Added by harvest.",
          "items": { "type": "string" }
        },
        "graph_attributes": {
          "type": "object",
          "description": "Rich analytical attributes generated by Invoke-AttributeExtraction. Optional — populated organically.",
          "additionalProperties": true,
          "properties": {
            "node_scope": {
              "type": "string",
              "enum": ["claim", "scheme", "bridging"],
              "description": "AIF-aligned classification of the node's role in argumentation."
            },
            "epistemic_type": {
              "type": "string",
              "description": "The epistemic category of the node's content."
            },
            "steelman_vulnerability": {
              "description": "The strongest counterargument(s). String (legacy) or per-POV object.",
              "oneOf": [
                { "type": "string" },
                {
                  "type": "object",
                  "properties": {
                    "from_accelerationist": { "type": "string" },
                    "from_safetyist": { "type": "string" },
                    "from_skeptic": { "type": "string" }
                  },
                  "additionalProperties": false
                }
              ]
            }
          }
        }
      }
    }
  }
}
