{
  "_schema_version": "1.0.0",
  "_doc": "Cross-cutting taxonomy: concepts that appear in all three camps but carry different interpretations. These nodes are referenced by all three POV taxonomy files.",
  "last_modified": "2026-03-03",
  "nodes": [
    {
      "id": "cc-001",
      "label": "AGI Timelines",
      "description": "When will Artificial General Intelligence be achieved? All three camps reference this; interpretations diverge radically on both the timeline and its implications.",
      "interpretations": {
        "accelerationist": "AGI within 5-10 years; an urgent reason to invest now and shape its development.",
        "safetyist": "AGI within 5-10 years; an urgent reason for alignment research before capability overhang.",
        "skeptic": "AGI timelines are speculative hype that distracts from present, measurable harms."
      },
      "linked_nodes": [
        "acc-goals-002",
        "acc-data-002",
        "saf-data-002",
        "skp-methods-005"
      ],
      "conflict_ids": [
        "conflict-agi-timelines-001"
      ]
    },
    {
      "id": "cc-002",
      "label": "The Alignment Problem",
      "description": "The challenge of ensuring AI systems reliably pursue intended goals. Central to all camps; urgency and solvability are contested.",
      "interpretations": {
        "accelerationist": "A real but tractable engineering problem; solving it is one more reason to move fast with capable labs leading.",
        "safetyist": "An existential-level unsolved problem that must be resolved before further capability deployment.",
        "skeptic": "A useful framing for future risk that is used to avoid accountability for alignment failures happening today (bias, misuse)."
      },
      "linked_nodes": [
        "saf-goals-003",
        "saf-data-001",
        "saf-methods-001",
        "acc-methods-001"
      ],
      "conflict_ids": []
    },
    {
      "id": "cc-003",
      "label": "AI Governance and Regulation",
      "description": "All camps want 'good governance'; their definitions of what that means are largely incompatible.",
      "interpretations": {
        "accelerationist": "Light-touch regulation that does not stifle innovation; industry self-governance preferred.",
        "safetyist": "Strong international coordination to pause or constrain frontier model development.",
        "skeptic": "Immediate domestic regulation targeting deployed systems and their discriminatory effects."
      },
      "linked_nodes": [
        "acc-goals-003",
        "saf-goals-002",
        "skp-methods-001",
        "skp-methods-002",
        "saf-methods-001",
        "skp-goals-003",
        "acc-methods-002"
      ],
      "conflict_ids": []
    },
    {
      "id": "cc-004",
      "label": "Harm",
      "description": "Core vocabulary used by all three camps. The word 'harm' means entirely different things across POVs — different time horizons, different subjects, different severity thresholds.",
      "interpretations": {
        "accelerationist": "Harm = failing to deploy AI, thereby allowing preventable disease/poverty to continue.",
        "safetyist": "Harm = catastrophic or irreversible outcomes from misaligned advanced AI.",
        "skeptic": "Harm = documented, present-day discriminatory outcomes and labor displacement affecting real people now."
      },
      "linked_nodes": [
        "saf-goals-001",
        "skp-goals-001",
        "skp-goals-002",
        "skp-methods-005"
      ],
      "conflict_ids": []
    },
    {
      "id": "cc-005",
      "label": "Risk",
      "description": "Same word; radically different probability estimates, time horizons, and moral weight across camps.",
      "interpretations": {
        "accelerationist": "Risk = low-probability tail events; present opportunity cost of not deploying AI is the dominant risk.",
        "safetyist": "Risk = high-probability catastrophic outcome if alignment is unsolved before AGI; expected value dominates.",
        "skeptic": "Risk = near-certain ongoing harm to marginalized groups from currently deployed systems."
      },
      "linked_nodes": [
        "saf-goals-001",
        "saf-data-002",
        "skp-methods-001"
      ],
      "conflict_ids": []
    },
    {
      "id": "cc-006",
      "label": "AI Accuracy and Reliability as a Deployment Criterion",
      "description": "All three camps invoke the accuracy or reliability of AI systems when arguing about deployment decisions, but they disagree fundamentally on what accuracy measures, what threshold is sufficient, and whose errors count. The word \"accurate\" creates the illusion of a shared, technical standard while concealing incompatible underlying commitments about risk, interpretability, and distributional fairness.",
      "interpretations": {
        "accelerationist": "Aggregate task accuracy on benchmarks (e.g., >90%) is a sufficient condition for deployment; performance at scale justifies moving forward.",
        "safetyist": " Benchmark accuracy is necessary but not sufficient; without interpretability of internal mechanisms, high accuracy on known tasks provides no guarantee of reliable behavior in novel or high-stakes contexts.",
        "skeptic": "Aggregate accuracy figures obscure disparate error rates across subgroups; a model achieving 90% overall may systematically fail on statutes affecting immigrants, low-income workers, or other marginalized populations — and those failures cause the most harm."
      },
      "linked_nodes": [
        "acc-data-003",
        "saf-data-003",
        "acc-methods-003",
        "saf-data-004",
        "saf-data-005",
        "skp-methods-002"
      ],
      "conflict_ids": []
    },
    {
      "id": "cc-007",
      "label": "Government-led AGI 'Project",
      "description": "The proposal that, due to national security implications, the US government will and should take control of the race to AGI, consolidating private labs into a national effort akin to the Manhattan Project.",
      "interpretations": {
        "accelerationist": "A necessary mobilization to ensure America builds AGI first and maintains its geopolitical leadership over authoritarian rivals.",
        "safetyist": "A necessary step to implement state-level security, manage catastrophic safety risks during the intelligence explosion, and establish a sane chain of command for superintelligence.",
        "skeptic": "A dangerous militarization and concentration of power that bypasses democratic oversight and accountability, while focusing on speculative future threats instead of present-day harms."
      },
      "linked_nodes": [],
      "conflict_ids": []
    },
    {
      "id": "cc-008",
      "label": "Intelligence Explosion via Automated AI Research",
      "description": "The hypothesis that AGI-level systems will automate AI research, creating a recursive feedback loop that compresses decades of algorithmic progress into a short period, leading to a rapid transition to superintelligence.",
      "interpretations": {
        "accelerationist": "The ultimate outcome of the AGI race, unlocking unprecedented scientific and economic progress.",
        "safetyist": "A period of extreme volatility and risk, where alignment techniques could catastrophically fail and control could be lost.",
        "skeptic": "A speculative, sci-fi narrative that distracts from present-day AI harms and is used to justify extreme measures."
      },
      "linked_nodes": [
        "acc-data-001",
        "saf-data-007"
      ],
      "conflict_ids": []
    },
    {
      "id": "cc-009",
      "label": "Geopolitical Competition as Primary AI Driver",
      "description": "The view that the primary lens for AI development and governance should be the strategic competition between democratic nations and authoritarian rivals, with the outcome determining the future world order.",
      "interpretations": {
        "accelerationist": "The core justification for accelerating AI development and mobilizing national resources to ensure victory.",
        "safetyist": "A major risk factor that creates pressure to race, but also a reason to secure a lead to create a margin for safety.",
        "skeptic": "A dangerous militarization of technology that concentrates power and diverts attention and resources from addressing domestic harms."
      },
      "linked_nodes": [
        "acc-goals-002",
        "saf-methods-009"
      ],
      "conflict_ids": []
    },
    {
      "id": "cc-010",
      "label": "Competitive Pressure vs. Safety Thresholds",
      "description": "The tension between maintaining strict, pre-defined safety standards and the strategic pressure to accelerate development or deployment in response to less-cautious competitors in the AI landscape.",
      "interpretations": {
        "accelerationist": "This is a necessary, if overly cautious, acknowledgment that racing dynamics are real and that rigid safetyism can lead to ceding the frontier to irresponsible actors.",
        "safetyist": "This is a dangerous loophole that could justify lowering safety standards under competitive pressure, though the proposed safeguards attempt to mitigate this risk.",
        "skeptic": "This highlights how the entire safety narrative is intertwined with corporate competition and market positioning, rather than being a pure commitment to public good."
      },
      "linked_nodes": [
        "acc-methods-001",
        "saf-methods-010"
      ],
      "conflict_ids": []
    },
    {
      "id": "cc-011",
      "label": "Sharing Models vs. Keeping Secrets",
      "description": "This debate centers on whether making AI code public helps everyone stay safe or creates a dangerous tool for bad actors. Think of it like deciding whether to publish a blueprint for a new type of lock: it could help people improve security, or it could show thieves exactly how to break in.",
      "interpretations": {